{
  "bank": {
    "554": 1000,
    "555": 1000,
    "556": 1000,
    "557": 1000,
    "561": 1000,
    "563": 1000,
    "772": 1000,
    "837": 1000,
    "954": 1000,
    "975": 1000,
    "995": 1000,
    "1265": 1000,
    "1351": 1000,
    "1854": 1000,
    "2552": 1000,
    "3853": 1000,
    "4251": 1000,
    "6707": 1000,
    "8007": 1000,
    "8008": 1000,
    "8009": 1000,
    "8010": 1000,
    "8011": 1000,
    "8012": 1000,
    "8013": 1000,
    "9418": 1000,
    "11140": 1000,
    "11194": 1000,
    "11866": 1000,
    "11968": 1000,
    "11972": 1000,
    "11978": 1000,
    "11980": 1000,
    "12402": 1000,
    "12403": 1000,
    "12404": 1000,
    "12406": 1000,
    "12407": 1000,
    "12409": 1000,
    "12410": 1000,
    "12938": 1000,
    "13110": 1000,
    "13114": 1000,
    "13123": 1000,
    "13127": 1000,
    "13131": 1000,
    "13135": 1000,
    "13139": 1000,
    "13143": 1000,
    "13393": 1000,
    "13660": 1000,
    "19564": 1000,
    "21146": 1000,
    "21166": 1000,
    "21389": 1000,
    "21760": 1000,
    "22400": 1000,
    "22599": 1000,
    "22601": 1000,
    "22945": 1000,
    "23946": 1000,
    "25818": 1000,
    "29273": 1000,
    "29893": 1000,
    "32399": 1000
  },
  "completedQuests": [
    "Another Slice of H.A.M.",
    "Architectural Alliance",
    "Beneath Cursed Sands",
    "Between a Rock...",
    "Biohazard",
    "Bone Voyage",
    "Cabin Fever",
    "Children of the Sun",
    "Client of Kourend",
    "Creature of Fenkenstrain",
    "Darkness of Hallowvale",
    "Death to the Dorgeshuun",
    "Dragon Slayer I",
    "Enlightened Journey",
    "Enter the Abyss",
    "Fishing Contest",
    "Garden of Tranquillity",
    "Haunted Mine",
    "Holy Grail",
    "Icthlarin's Little Helper",
    "In Search of the Myreque",
    "Land of the Goblins",
    "Legends' Quest",
    "Lost City",
    "Making Friends with My Arm",
    "Monkey Madness I",
    "Mountain Daughter",
    "Mourning's End Part I",
    "Nature Spirit",
    "Observatory Quest",
    "Plague City",
    "Priest in Peril",
    "Regicide",
    "Sea Slug",
    "Shades of Mort'ton",
    "Shilo Village",
    "Sins of the Father",
    "Song of the Elves",
    "Swan Song",
    "Tai Bwo Wannai Trio",
    "Tears of Guthix",
    "The Corsair Curse",
    "The Depths of Despair",
    "The Forsaken Tower",
    "The Fremennik Isles",
    "The Fremennik Trials",
    "The Giant Dwarf",
    "The Golem",
    "The Grand Tree",
    "The Lost Tribe",
    "The Path of Glouphrie",
    "The Queen of Thieves",
    "The Tale of the Righteous",
    "Throne of Miscellania",
    "Tree Gnome Village",
    "Troubled Tortugans",
    "Twilight's Promise",
    "Watchtower",
    "Waterfall Quest",
    "Zogre Flesh Eaters"
  ],
  "diaries": {
    "Ardougne": "Hard",
    "Desert": "Hard",
    "Falador": "Hard",
    "Fremennik": "Hard",
    "Kandarin": "Hard",
    "Karamja": "Hard",
    "KourendKebos": "Hard",
    "LumbridgeDraynor": "Hard",
    "Morytania": "Hard",
    "Varrock": "Hard",
    "WesternProvinces": "Hard",
    "Wilderness": "Hard"
  },
  "equipment": {},
  "fairyRingsUnlocked": true,
  "inventory": {
    "772": 1,
    "995": 1000000,
    "1704": 1,
    "2552": 1,
    "3853": 1,
    "8013": 1,
    "11190": 1,
    "11866": 1,
    "29271": 1
  },
  "levels": {
    "Agility": 80,
    "Attack": 80,
    "Construction": 78,
    "Cooking": 80,
    "Crafting": 80,
    "Defence": 80,
    "Farming": 83,
    "Firemaking": 80,
    "Fishing": 80,
    "Fletching": 80,
    "Herblore": 78,
    "Hitpoints": 85,
    "Hunter": 80,
    "Magic": 85,
    "Mining": 80,
    "Prayer": 70,
    "Ranged": 80,
    "Runecraft": 75,
    "Sailing": 75,
    "Slayer": 80,
    "Smithing": 80,
    "Strength": 85,
    "Thieving": 82,
    "Woodcutting": 80
  },
  "plantedSpiritTrees": [
    "FARMING_GUILD"
  ],
  "poh": {
    "fairyRing": false,
    "jewelleryBox": "FancyJewelleryBox",
    "location": "Rimmington",
    "mountedDigsite": true,
    "mountedGlory": true,
    "mountedMythical": true,
    "mountedXerics": true,
    "obelisk": false,
    "portals": {
      "destinations": [
        "Ardougne Portal",
        "Barrows Portal",
        "Camelot Portal",
        "Falador Portal",
        "Kourend Portal",
        "Varrock Portal"
      ],
      "mode": "selected"
    },
    "spiritTree": false
  },
  "runePouch": {
    "554": 10000,
    "555": 10000,
    "556": 10000,
    "563": 10000
  },
  "runtime": {
    "arriveInsidePoh": true,
    "minigameTeleport": {
      "state": "ready"
    },
    "spellbook": "Standard"
  },
  "schemaVersion": 1,
  "id": "mid",
  "name": "mid",
  "benchmarkNowMinutes": 100000000,
  "routingVariables": {
    "varbits": {
      "260": 70,
      "299": 10,
      "346": 10,
      "418": 26,
      "451": 2,
      "487": 14,
      "496": 1,
      "532": 12,
      "538": 1,
      "621": 1,
      "668": 1,
      "2098": 200,
      "2187": 1,
      "2573": 320,
      "2867": 2,
      "2868": 2,
      "2869": 1,
      "2870": 1,
      "2871": 1,
      "2872": 1,
      "3264": 11,
      "3311": 340,
      "3578": 1,
      "3598": 1,
      "3599": 1,
      "3611": 1,
      "3637": 153,
      "3741": 1,
      "3759": 2,
      "3910": 1,
      "4070": 0,
      "4441": 2,
      "4458": 1,
      "4459": 1,
      "4460": 1,
      "4461": 0,
      "4462": 1,
      "4463": 1,
      "4464": 1,
      "4465": 0,
      "4466": 1,
      "4467": 1,
      "4468": 1,
      "4469": 0,
      "4471": 1,
      "4472": 1,
      "4473": 1,
      "4474": 0,
      "4475": 1,
      "4476": 1,
      "4477": 1,
      "4478": 0,
      "4479": 1,
      "4480": 1,
      "4481": 1,
      "4482": 0,
      "4483": 1,
      "4484": 1,
      "4485": 1,
      "4486": 0,
      "4487": 1,
      "4488": 1,
      "4489": 1,
      "4490": 0,
      "4491": 1,
      "4492": 1,
      "4493": 1,
      "4494": 0,
      "4495": 1,
      "4496": 1,
      "4497": 1,
      "4498": 0,
      "4541": 0,
      "4542": 0,
      "4548": 0,
      "4552": 0,
      "4558": 0,
      "4560": 0,
      "4561": 0,
      "4564": 0,
      "4566": 0,
      "4585": 0,
      "4744": 0,
      "4819": 0,
      "5005": 0,
      "5023": 2,
      "5087": 1,
      "5088": 1,
      "5421": 1,
      "5619": 1,
      "5629": 1,
      "5672": 1,
      "5673": 1,
      "5674": 1,
      "5675": 1,
      "5676": 1,
      "5677": 1,
      "5678": 1,
      "5679": 1,
      "5680": 1,
      "5681": 1,
      "5682": 1,
      "5683": 1,
      "5684": 1,
      "5810": 1,
      "6027": 7,
      "6028": 1,
      "6038": 1,
      "6056": 1,
      "6069": 0,
      "6076": 1,
      "6312": 1,
      "6359": 1,
      "6528": 207,
      "7255": 88,
      "7796": 11,
      "7801": 1,
      "7857": 1,
      "7925": 1,
      "7926": 1,
      "7927": 1,
      "7928": 0,
      "7937": 0,
      "7938": 0,
      "8253": 1,
      "8397": 1,
      "8398": 1,
      "9805": 1,
      "10449": 1,
      "10450": 1,
      "10528": 1,
      "11175": 1,
      "11176": 1,
      "11177": 1,
      "11178": 1,
      "11410": 9,
      "12310": 1,
      "12341": 1,
      "13599": 50,
      "13839": 1,
      "13841": 108,
      "17226": 1,
      "18351": 1,
      "18355": 1,
      "18356": 1,
      "18370": 1,
      "18371": 1
    },
    "varplayers": {
      "11": 5,
      "65": 10,
      "111": 9,
      "116": 15,
      "139": 75,
      "150": 160,
      "165": 30,
      "176": 10,
      "212": 14,
      "328": 15,
      "359": 100,
      "517": 9,
      "888": 99999979,
      "892": 0,
      "4182": 18912,
      "4560": 0
    }
  }
}
