{
  "bank": {
    "772": 1000,
    "995": 1000,
    "1704": 1000,
    "2552": 1000,
    "3853": 1000,
    "8013": 1000,
    "11105": 1000,
    "11118": 1000,
    "11980": 1000,
    "21146": 1000
  },
  "completedQuests": [
    "Another Slice of H.A.M.",
    "Biohazard",
    "Bone Voyage",
    "Children of the Sun",
    "Client of Kourend",
    "Creature of Fenkenstrain",
    "Death to the Dorgeshuun",
    "Dragon Slayer I",
    "Enter the Abyss",
    "Garden of Tranquillity",
    "Haunted Mine",
    "Holy Grail",
    "In Search of the Myreque",
    "Lost City",
    "Monkey Madness I",
    "Nature Spirit",
    "Observatory Quest",
    "Plague City",
    "Priest in Peril",
    "Regicide",
    "Sea Slug",
    "Shades of Mort'ton",
    "Tai Bwo Wannai Trio",
    "The Corsair Curse",
    "The Fremennik Trials",
    "The Giant Dwarf",
    "The Grand Tree",
    "The Lost Tribe",
    "Tree Gnome Village",
    "Twilight's Promise",
    "Watchtower"
  ],
  "diaries": {
    "Ardougne": "Medium",
    "Desert": "Medium",
    "Falador": "Medium",
    "Fremennik": "Medium",
    "Kandarin": "Medium",
    "Karamja": "Medium",
    "KourendKebos": "Medium",
    "LumbridgeDraynor": "Medium",
    "Morytania": "Medium",
    "Varrock": "Medium",
    "WesternProvinces": "Medium",
    "Wilderness": "Medium"
  },
  "equipment": {},
  "fairyRingsUnlocked": true,
  "inventory": {
    "772": 1,
    "995": 100000,
    "1704": 1,
    "2552": 1,
    "3853": 1,
    "8013": 1
  },
  "levels": {
    "Agility": 70,
    "Attack": 70,
    "Construction": 60,
    "Cooking": 70,
    "Crafting": 65,
    "Defence": 70,
    "Farming": 65,
    "Firemaking": 70,
    "Fishing": 65,
    "Fletching": 65,
    "Herblore": 65,
    "Hitpoints": 75,
    "Hunter": 65,
    "Magic": 70,
    "Mining": 65,
    "Prayer": 60,
    "Ranged": 70,
    "Runecraft": 60,
    "Sailing": 60,
    "Slayer": 65,
    "Smithing": 65,
    "Strength": 75,
    "Thieving": 65,
    "Woodcutting": 65
  },
  "plantedSpiritTrees": [],
  "poh": {
    "fairyRing": false,
    "jewelleryBox": "NoJewelleryBox",
    "location": "Rimmington",
    "mountedDigsite": false,
    "mountedGlory": false,
    "mountedMythical": false,
    "mountedXerics": false,
    "obelisk": false,
    "portals": {
      "destinations": [],
      "mode": "selected"
    },
    "spiritTree": false
  },
  "runePouch": {
    "554": 10000,
    "555": 10000,
    "556": 10000,
    "563": 10000
  },
  "runtime": {
    "arriveInsidePoh": true,
    "minigameTeleport": {
      "state": "ready"
    },
    "spellbook": "Standard"
  },
  "schemaVersion": 1,
  "id": "early",
  "name": "early",
  "benchmarkNowMinutes": 100000000,
  "routingVariables": {
    "varbits": {
      "260": 0,
      "299": 0,
      "346": 0,
      "418": 0,
      "451": 0,
      "487": 0,
      "496": 0,
      "532": 12,
      "538": 0,
      "621": 0,
      "668": 0,
      "2098": 0,
      "2187": 1,
      "2573": 0,
      "2867": 0,
      "2868": 0,
      "2869": 0,
      "2870": 0,
      "2871": 0,
      "2872": 0,
      "3264": 0,
      "3311": 0,
      "3578": 1,
      "3598": 1,
      "3599": 1,
      "3611": 0,
      "3637": 0,
      "3741": 1,
      "3759": 0,
      "3910": 0,
      "4070": 0,
      "4441": 0,
      "4458": 1,
      "4459": 1,
      "4460": 0,
      "4461": 0,
      "4462": 1,
      "4463": 1,
      "4464": 0,
      "4465": 0,
      "4466": 1,
      "4467": 1,
      "4468": 0,
      "4469": 0,
      "4471": 1,
      "4472": 1,
      "4473": 0,
      "4474": 0,
      "4475": 1,
      "4476": 1,
      "4477": 0,
      "4478": 0,
      "4479": 1,
      "4480": 1,
      "4481": 0,
      "4482": 0,
      "4483": 1,
      "4484": 1,
      "4485": 0,
      "4486": 0,
      "4487": 1,
      "4488": 1,
      "4489": 0,
      "4490": 0,
      "4491": 1,
      "4492": 1,
      "4493": 0,
      "4494": 0,
      "4495": 1,
      "4496": 1,
      "4497": 0,
      "4498": 0,
      "4541": 0,
      "4542": 0,
      "4548": 0,
      "4552": 0,
      "4558": 0,
      "4560": 0,
      "4561": 0,
      "4564": 0,
      "4566": 0,
      "4585": 0,
      "4744": 0,
      "4819": 0,
      "5005": 0,
      "5023": 0,
      "5087": 0,
      "5088": 0,
      "5421": 0,
      "5619": 1,
      "5629": 0,
      "5672": 0,
      "5673": 0,
      "5674": 0,
      "5675": 0,
      "5676": 0,
      "5677": 0,
      "5678": 0,
      "5679": 0,
      "5680": 0,
      "5681": 0,
      "5682": 0,
      "5683": 0,
      "5684": 0,
      "5810": 0,
      "6027": 0,
      "6028": 0,
      "6038": 0,
      "6056": 0,
      "6069": 0,
      "6076": 1,
      "6312": 1,
      "6359": 0,
      "6528": 0,
      "7255": 0,
      "7796": 0,
      "7801": 0,
      "7857": 0,
      "7925": 1,
      "7926": 1,
      "7927": 0,
      "7928": 0,
      "7937": 0,
      "7938": 0,
      "8253": 0,
      "8397": 0,
      "8398": 0,
      "9805": 0,
      "10449": 0,
      "10450": 0,
      "10528": 0,
      "11175": 0,
      "11176": 0,
      "11177": 0,
      "11178": 0,
      "11410": 0,
      "12310": 0,
      "12341": 0,
      "13599": 0,
      "13839": 0,
      "13841": 0,
      "17226": 0,
      "18351": 0,
      "18355": 0,
      "18356": 0,
      "18370": 0,
      "18371": 0
    },
    "varplayers": {
      "11": 0,
      "65": 0,
      "111": 9,
      "116": 0,
      "139": 0,
      "150": 160,
      "165": 30,
      "176": 10,
      "212": 14,
      "328": 15,
      "359": 0,
      "517": 0,
      "888": 99999979,
      "892": 0,
      "4182": 0,
      "4560": 0
    }
  }
}
